{
  "adapter_document_digest": "sha-256:6183900e606b5faf91950cfb565ae40af63940c8d7056611d1eb9aa52f2b1972",
  "adapter_schema_id": "artifact-memory/restic-sftp-config/v1",
  "authority_boundary": "custody preflight evidence grants no remote-write, execution, credential, or infrastructure authority",
  "binding_names": [
    "endpoint_ref",
    "fallback_account_state",
    "provisioned_account_state",
    "provisioned_address_state",
    "provisioned_storage_state",
    "remote_write",
    "transport_authorization"
  ],
  "bindings_digest": "sha-256:12f8260ad5aea3920b2ecdc52159bddfee4ac733045338b013c7cd0179eeec32",
  "endpoint_document_digest": "sha-256:f7e7e28c9f819c07387a1e2aef9d8174f6815142be8ebc16d236a2c517e426a9",
  "endpoint_ref": "endpoint://joe-home-proxmox-vault-1",
  "endpoint_schema_id": "artifact-memory/custody-endpoint/v2",
  "limitations": [
    "no network connection or remote write was attempted",
    "connection details and secret material are not represented",
    "explicit owner authorization remains required before any remote write"
  ],
  "outcome": "not-authorized",
  "receipt_id": "custody-write-preflight-receipt://7b659b2afa0db6c539e45f0383d23b7673eeacdc8da5a2f44487af6715bbceea",
  "schema_id": "artifact-memory/custody-write-preflight-receipt/v1",
  "transport": "restic-over-sftp"
}
